{
  "artifact_id": "4605986d-dd51-5980-8f9b-9adf38960050",
  "artifact_type": "ROLE_CONTEXT_BUNDLE",
  "created_at": "2026-04-08T00:00:00Z",
  "expires_at": null,
  "input_artifact_refs": [
    "artifact://environment-spec/eng_ipopt_onemkl_docker",
    "artifact://evidence-bundle/ipopt_runtime",
    "artifact://evidence-bundle/pyoptsparse_runtime",
    "artifact://execution-adapter-spec/ipopt_probe",
    "artifact://execution-adapter-spec/pyoptsparse_probe",
    "artifact://knowledge-pack/coinhsl_family",
    "artifact://knowledge-pack/ipopt",
    "artifact://knowledge-pack/nlp_time_chem_family",
    "artifact://knowledge-pack/onemkl",
    "artifact://knowledge-pack/pyoptsparse",
    "artifact://recipe-object/ipopt_seed_stack",
    "artifact://recipe-object/pyoptsparse_optimization_uq_backbone",
    "artifact://verification-report/5487d998-75b1-5bc3-8487-d1a3efd23574",
    "artifact://verification-report/ff85002e-061e-5d40-b2d8-6dfb3b48dbe3"
  ],
  "invalid_reasons": [],
  "payload": {
    "compiled_summary": "IPOPT: solves IPOPT backend kernels reused by core engineering workflows, IPOPT low-level numeric or geometric primitives inside a linked execution adapter. Best for IPOPT inside core engineering workflows. Avoid Using IPOPT as a substitute for unrelated workflows outside core engineering workflows, Treating IPOPT as implicitly verified without its linked runtime and evidence bundle. Runtime eng-ipopt-onemkl/docker_image at birtha/knowledge-eng-ipopt-onemkl:1.0.0; environment ref artifact://environment-spec/eng_ipopt_onemkl_docker; healthcheck commands python scripts/verify_knowledge_runtime.py --environment-ref artifact://environment-spec/eng_ipopt_onemkl_docker; verification refs artifact://verification-report/5487d998-75b1-5bc3-8487-d1a3efd23574. Runtime gate: Bootstrap failed for artifact://environment-spec/eng_ipopt_onemkl_docker: #0 building with \"desktop-linux\" instance using docker driver.\npyOptSparse: solves pyOptSparse API-driven workflows for optimization, UQ, and numerical-backbone workflows, pyOptSparse model assembly and orchestration inside a typed runtime boundary. Best for pyOptSparse inside optimization, UQ, and numerical-backbone workflows. Avoid Using pyOptSparse as a substitute for unrelated workflows outside optimization, UQ, and numerical-backbone workflows, Treating pyOptSparse as implicitly verified without its linked runtime and evidence bundle. Runtime eng-ipopt-onemkl/docker_image at birtha/knowledge-eng-ipopt-onemkl:1.0.0; environment ref artifact://environment-spec/eng_ipopt_onemkl_docker; healthcheck commands python scripts/verify_knowledge_runtime.py --environment-ref artifact://environment-spec/eng_ipopt_onemkl_docker; verification refs artifact://verification-report/ff85002e-061e-5d40-b2d8-6dfb3b48dbe3. Runtime gate: Bootstrap failed for artifact://environment-spec/eng_ipopt_onemkl_docker: #0 building with \"desktop-linux\" instance using docker driver.",
    "excluded_sections": [
      "apis and objects",
      "file contracts",
      "adapter usage",
      "minimal scaffolds",
      "implementation failure modes",
      "invariants",
      "unit checks",
      "validation cases",
      "anti-patterns",
      "acceptance thresholds"
    ],
    "included_sections": [
      "capability boundaries",
      "tradeoffs",
      "fidelity and cost",
      "integration fit",
      "expected outputs"
    ],
    "retrieval_keys": [
      "general",
      "ipopt",
      "parent_runtime",
      "phase3_parent_ipopt",
      "true"
    ],
    "role": "general",
    "role_context_bundle_id": "general_77f184e988b18a9a",
    "schema_version": "1.0.0",
    "source_artifact_refs": [
      "artifact://environment-spec/eng_ipopt_onemkl_docker",
      "artifact://evidence-bundle/ipopt_runtime",
      "artifact://evidence-bundle/pyoptsparse_runtime",
      "artifact://execution-adapter-spec/ipopt_probe",
      "artifact://execution-adapter-spec/pyoptsparse_probe",
      "artifact://knowledge-pack/coinhsl_family",
      "artifact://knowledge-pack/ipopt",
      "artifact://knowledge-pack/nlp_time_chem_family",
      "artifact://knowledge-pack/onemkl",
      "artifact://knowledge-pack/pyoptsparse",
      "artifact://recipe-object/ipopt_seed_stack",
      "artifact://recipe-object/pyoptsparse_optimization_uq_backbone",
      "artifact://verification-report/5487d998-75b1-5bc3-8487-d1a3efd23574",
      "artifact://verification-report/ff85002e-061e-5d40-b2d8-6dfb3b48dbe3"
    ],
    "source_hashes": [
      {
        "artifact_ref": "artifact://environment-spec/eng_ipopt_onemkl_docker",
        "sha256": "32569f4f18dadca67c1db0183ba8513468d6c59b4d93da352bd18c3faddbabf5"
      },
      {
        "artifact_ref": "artifact://evidence-bundle/ipopt_runtime",
        "sha256": "827a714077c61b1dc93d99d4b0824c3ece9b7c915ad3063727eff97a28da7e6e"
      },
      {
        "artifact_ref": "artifact://evidence-bundle/pyoptsparse_runtime",
        "sha256": "60e1f137eddbde6503f61e06bcd8b9f8432230f4d7cebf8e21b636eb2ca77b6d"
      },
      {
        "artifact_ref": "artifact://execution-adapter-spec/ipopt_probe",
        "sha256": "7093b9833fc49be0fcee46718b7056931d3ffe737595620b09e94197cf72650b"
      },
      {
        "artifact_ref": "artifact://execution-adapter-spec/pyoptsparse_probe",
        "sha256": "f7861bdfd070f959145533e5b6873a929d951f2d2f70004eceef0e405a9dd7aa"
      },
      {
        "artifact_ref": "artifact://knowledge-pack/coinhsl_family",
        "sha256": "8341aee06ed45a0fe2b8c6a951a8cdfa3622f3117e9244ca7b4829bfaf60e572"
      },
      {
        "artifact_ref": "artifact://knowledge-pack/ipopt",
        "sha256": "7bbe6fe7c6a52cd6c401076b4cfa96356ed31c107955ec9f8e95e14e85c3e6ab"
      },
      {
        "artifact_ref": "artifact://knowledge-pack/nlp_time_chem_family",
        "sha256": "ae753921bf274193c7f330b99a74f02760e1ee93cd8aa51c51e2e7392edda7cc"
      },
      {
        "artifact_ref": "artifact://knowledge-pack/onemkl",
        "sha256": "33c9bee9f7f1ed92234f65c8c2b9f23f7679731fcb1bd38dfbbbaf65c35b27e9"
      },
      {
        "artifact_ref": "artifact://knowledge-pack/pyoptsparse",
        "sha256": "e885dc6ff9b41a5615cbcbddd282b1571e8272df0705ea9d3040d9275036c784"
      },
      {
        "artifact_ref": "artifact://recipe-object/ipopt_seed_stack",
        "sha256": "c6cd9b57cbd100c12fa41c78b1fa19db6ab4de1426ade4b06465e0da8ec36b50"
      },
      {
        "artifact_ref": "artifact://recipe-object/pyoptsparse_optimization_uq_backbone",
        "sha256": "4cafd4096dba6aa6de6e13e1bc84d26291d6bc1a227903bffc3876063df6a6a6"
      },
      {
        "artifact_ref": "artifact://verification-report/5487d998-75b1-5bc3-8487-d1a3efd23574",
        "sha256": "b39ad9d8585200e6344734b11bcc14922faef23c05046589c23c71111857b8c2"
      },
      {
        "artifact_ref": "artifact://verification-report/ff85002e-061e-5d40-b2d8-6dfb3b48dbe3",
        "sha256": "a0ed57c2b562cb5d738cb2c6ed2736b0d000db51d7b8d50ac9c4d482db599193"
      }
    ],
    "task_class": "phase3_parent_ipopt"
  },
  "producer": {
    "component": "control_plane.knowledge_pool",
    "executor": "deterministic_compiler",
    "run_id": null,
    "task_packet_id": null
  },
  "schema_version": "1.0.0",
  "status": "ACTIVE",
  "supersedes": [],
  "updated_at": "2026-04-08T00:00:00Z",
  "validation_state": "VALID"
}
