{
  "artifact_id": "a9e664ca-9108-58e9-85d1-e2b17b5319f7",
  "artifact_type": "ROLE_CONTEXT_BUNDLE",
  "created_at": "2026-04-08T00:00:00Z",
  "expires_at": null,
  "input_artifact_refs": [
    "artifact://environment-spec/eng_openwam_docker",
    "artifact://evidence-bundle/openwam_runtime",
    "artifact://execution-adapter-spec/openwam_probe",
    "artifact://knowledge-pack/openwam",
    "artifact://recipe-object/openwam_thermofluids_chemistry",
    "artifact://verification-report/cd0be843-bd6a-5d3e-ab00-7758d10fb8df"
  ],
  "invalid_reasons": [],
  "payload": {
    "compiled_summary": "OpenWAM: use OpenWAM CLI, OpenWAM case/setup artifact, eng_openwam_docker. Adapter python scripts/verify_knowledge_runtime.py --environment-ref artifact://environment-spec/eng_openwam_docker takes working_dir, problem. Launcher knowledge/coding-tools/runtime/launchers/eng_openwam-container.sh. Recipe OpenWAM phase 2 runtime-linked recipe follows Resolve artifact://environment-spec/eng_openwam_docker as the canonical runtime surface, Run the linked health check for OpenWAM, Stop if the runtime verification report is still REWORK, Execute OpenWAM only inside its declared capability boundary and record the evidence refs. Runtime eng-openwam/docker_image at birtha/knowledge-eng-openwam:1.0.0; environment ref artifact://environment-spec/eng_openwam_docker; healthcheck commands python scripts/verify_knowledge_runtime.py --environment-ref artifact://environment-spec/eng_openwam_docker; verification refs artifact://verification-report/cd0be843-bd6a-5d3e-ab00-7758d10fb8df. Runtime gate: Smoke failed for openwam: command exited with 1.",
    "excluded_sections": [
      "capability boundaries",
      "tradeoffs",
      "fidelity and cost",
      "integration fit",
      "expected outputs",
      "invariants",
      "unit checks",
      "validation cases",
      "anti-patterns",
      "acceptance thresholds"
    ],
    "included_sections": [
      "apis and objects",
      "file contracts",
      "adapter usage",
      "minimal scaffolds",
      "implementation failure modes"
    ],
    "retrieval_keys": [
      "coder",
      "openwam",
      "package",
      "phase3_package_openwam",
      "true"
    ],
    "role": "coder",
    "role_context_bundle_id": "coder_fdcddf09739fb58e",
    "schema_version": "1.0.0",
    "source_artifact_refs": [
      "artifact://environment-spec/eng_openwam_docker",
      "artifact://evidence-bundle/openwam_runtime",
      "artifact://execution-adapter-spec/openwam_probe",
      "artifact://knowledge-pack/openwam",
      "artifact://recipe-object/openwam_thermofluids_chemistry",
      "artifact://verification-report/cd0be843-bd6a-5d3e-ab00-7758d10fb8df"
    ],
    "source_hashes": [
      {
        "artifact_ref": "artifact://environment-spec/eng_openwam_docker",
        "sha256": "f7421962f1048f406d61380c8832e005f58ad311b1a9314decb9722b486b4e85"
      },
      {
        "artifact_ref": "artifact://evidence-bundle/openwam_runtime",
        "sha256": "09f0089e2b0457f50cbc47118975ce1ecaced40e7115bfbbb01927bf3c3a87fc"
      },
      {
        "artifact_ref": "artifact://execution-adapter-spec/openwam_probe",
        "sha256": "19164da2a76a179b666e5bbba4f2a23944da06c6bdc64dccfed2e6538252ca48"
      },
      {
        "artifact_ref": "artifact://knowledge-pack/openwam",
        "sha256": "2cc9352380af6a18e570893dab252eb10a510989e7d4a13661faf15bb6f81ab0"
      },
      {
        "artifact_ref": "artifact://recipe-object/openwam_thermofluids_chemistry",
        "sha256": "0ee767e89d0e69e49b7c8cd63021b527b5d40379c6a329ccde75a6b464696c2c"
      },
      {
        "artifact_ref": "artifact://verification-report/cd0be843-bd6a-5d3e-ab00-7758d10fb8df",
        "sha256": "fd7bbd967775d05491b4735ed0c8ef4e532ba254297dbd85b367f60ed8fe1154"
      }
    ],
    "task_class": "phase3_package_openwam"
  },
  "producer": {
    "component": "control_plane.knowledge_pool",
    "executor": "deterministic_compiler",
    "run_id": null,
    "task_packet_id": null
  },
  "schema_version": "1.0.0",
  "status": "ACTIVE",
  "supersedes": [],
  "updated_at": "2026-04-08T00:00:00Z",
  "validation_state": "VALID"
}
