{
  "artifact_id": "2290b314-969d-5a20-bc0a-9690fabd3caa",
  "artifact_type": "ROLE_CONTEXT_BUNDLE",
  "created_at": "2026-04-08T00:00:00Z",
  "expires_at": null,
  "input_artifact_refs": [
    "artifact://environment-spec/eng_petsc_family_docker",
    "artifact://evidence-bundle/slepc_runtime",
    "artifact://execution-adapter-spec/slepc_probe",
    "artifact://knowledge-pack/petsc_family",
    "artifact://knowledge-pack/slepc",
    "artifact://recipe-object/slepc_solver_backends",
    "artifact://verification-report/29999cb5-52c7-5345-9aaf-d4dead355b41"
  ],
  "invalid_reasons": [],
  "payload": {
    "compiled_summary": "SLEPc: solves SLEPc backend kernels reused by solver-backend workflows, SLEPc low-level numeric or geometric primitives inside a linked execution adapter. Best for SLEPc inside solver-backend workflows. Avoid Using SLEPc as a substitute for unrelated workflows outside solver-backend workflows, Treating SLEPc as implicitly verified without its linked runtime and evidence bundle. Runtime eng-petsc-family/docker_image at birtha/knowledge-eng-petsc-family:1.0.0; environment ref artifact://environment-spec/eng_petsc_family_docker; healthcheck commands python scripts/verify_knowledge_runtime.py --environment-ref artifact://environment-spec/eng_petsc_family_docker; verification refs artifact://verification-report/29999cb5-52c7-5345-9aaf-d4dead355b41. Runtime gate: Bootstrap failed for artifact://environment-spec/eng_petsc_family_docker: #0 building with \"desktop-linux\" instance using docker driver.",
    "excluded_sections": [
      "apis and objects",
      "file contracts",
      "adapter usage",
      "minimal scaffolds",
      "implementation failure modes",
      "invariants",
      "unit checks",
      "validation cases",
      "anti-patterns",
      "acceptance thresholds"
    ],
    "included_sections": [
      "capability boundaries",
      "tradeoffs",
      "fidelity and cost",
      "integration fit",
      "expected outputs"
    ],
    "retrieval_keys": [
      "general",
      "package",
      "phase3_package_slepc",
      "slepc",
      "true"
    ],
    "role": "general",
    "role_context_bundle_id": "general_3f2b7131f1d9dc03",
    "schema_version": "1.0.0",
    "source_artifact_refs": [
      "artifact://environment-spec/eng_petsc_family_docker",
      "artifact://evidence-bundle/slepc_runtime",
      "artifact://execution-adapter-spec/slepc_probe",
      "artifact://knowledge-pack/petsc_family",
      "artifact://knowledge-pack/slepc",
      "artifact://recipe-object/slepc_solver_backends",
      "artifact://verification-report/29999cb5-52c7-5345-9aaf-d4dead355b41"
    ],
    "source_hashes": [
      {
        "artifact_ref": "artifact://environment-spec/eng_petsc_family_docker",
        "sha256": "6072a9ec8600f0d5a8cd2fd00b6c11529aa2d6d1dab2f924992030e4aae5f244"
      },
      {
        "artifact_ref": "artifact://evidence-bundle/slepc_runtime",
        "sha256": "3659872d866206686c3b4d6718989bb768aa7785bd8ec72fa84e1fa8c4ff1867"
      },
      {
        "artifact_ref": "artifact://execution-adapter-spec/slepc_probe",
        "sha256": "37c10eb31d76780fc6a5944287e70dac1dc860d31f92799fae72095680ad93c5"
      },
      {
        "artifact_ref": "artifact://knowledge-pack/petsc_family",
        "sha256": "e555bb51cea23d3cafa27b5d60a1d3aaa54f27eee77a92f8d561a1b12e71af1a"
      },
      {
        "artifact_ref": "artifact://knowledge-pack/slepc",
        "sha256": "5ffc193fa4ba95819b17b8c31a5ef56c2a262e01f7f78b939e52df4430207e3c"
      },
      {
        "artifact_ref": "artifact://recipe-object/slepc_solver_backends",
        "sha256": "fa647a9e7eddaf5d38f10a5c8ef7e4d0bf774b7cad9600cfa201f5be6c24c853"
      },
      {
        "artifact_ref": "artifact://verification-report/29999cb5-52c7-5345-9aaf-d4dead355b41",
        "sha256": "76e726108d23c193d22822dce7a8ba14b53295a5161c438a12f633a4d9959f5b"
      }
    ],
    "task_class": "phase3_package_slepc"
  },
  "producer": {
    "component": "control_plane.knowledge_pool",
    "executor": "deterministic_compiler",
    "run_id": null,
    "task_packet_id": null
  },
  "schema_version": "1.0.0",
  "status": "ACTIVE",
  "supersedes": [],
  "updated_at": "2026-04-08T00:00:00Z",
  "validation_state": "VALID"
}
