{
  "artifact_id": "078930a8-a528-5e7f-954d-6fa94b832754",
  "artifact_type": "ROLE_CONTEXT_BUNDLE",
  "created_at": "2026-04-08T00:00:00Z",
  "expires_at": null,
  "input_artifact_refs": [
    "artifact://environment-spec/eng_ipopt_onemkl_docker",
    "artifact://environment-spec/eng_ipopt_onemkl_gui",
    "artifact://evidence-bundle/pyoptsparse_runtime",
    "artifact://execution-adapter-spec/pyoptsparse_probe",
    "artifact://gui-session-spec/eng_ipopt_onemkl_gui",
    "artifact://knowledge-pack/pyoptsparse",
    "artifact://recipe-object/pyoptsparse_optimization_uq_backbone",
    "artifact://verification-report/d27e1fdf-9e1d-540f-88fc-99829a79dfc0",
    "artifact://verification-report/ff85002e-061e-5d40-b2d8-6dfb3b48dbe3"
  ],
  "invalid_reasons": [],
  "payload": {
    "compiled_summary": "pyOptSparse: use pyoptsparse, pyOptSparse model object, eng_ipopt_onemkl_docker. Adapter python scripts/verify_knowledge_runtime.py --environment-ref artifact://environment-spec/eng_ipopt_onemkl_docker takes working_dir, problem. Launcher knowledge/coding-tools/runtime/launchers/eng-ipopt-onemkl-container.sh. Recipe pyOptSparse phase 2 runtime-linked recipe follows Resolve artifact://environment-spec/eng_ipopt_onemkl_docker as the canonical runtime surface, Run the linked health check for pyOptSparse, Stop if the parent-runtime compatibility gate is still REWORK, Execute pyOptSparse only inside its declared capability boundary and record the evidence refs. Runtime eng-ipopt-onemkl/docker_image at birtha/knowledge-eng-ipopt-onemkl:1.0.0; environment ref artifact://environment-spec/eng_ipopt_onemkl_docker; healthcheck commands python scripts/verify_knowledge_runtime.py --environment-ref artifact://environment-spec/eng_ipopt_onemkl_docker; verification refs artifact://verification-report/ff85002e-061e-5d40-b2d8-6dfb3b48dbe3. GUI state PLANNED_CONTAINER_GUI; default GUI session artifact://gui-session-spec/eng_ipopt_onemkl_gui; control provider noVNC via OpenClaw browser.",
    "excluded_sections": [
      "capability boundaries",
      "tradeoffs",
      "fidelity and cost",
      "integration fit",
      "expected outputs",
      "invariants",
      "unit checks",
      "validation cases",
      "anti-patterns",
      "acceptance thresholds"
    ],
    "included_sections": [
      "apis and objects",
      "file contracts",
      "adapter usage",
      "minimal scaffolds",
      "implementation failure modes"
    ],
    "retrieval_keys": [
      "coder",
      "install",
      "phase1_batch3b_nlp_wrapper",
      "phase2_install_phase1_batch3b_nlp_wrapper",
      "true"
    ],
    "role": "coder",
    "role_context_bundle_id": "coder_863a7291d02306bb",
    "schema_version": "1.0.0",
    "source_artifact_refs": [
      "artifact://environment-spec/eng_ipopt_onemkl_docker",
      "artifact://environment-spec/eng_ipopt_onemkl_gui",
      "artifact://evidence-bundle/pyoptsparse_runtime",
      "artifact://execution-adapter-spec/pyoptsparse_probe",
      "artifact://gui-session-spec/eng_ipopt_onemkl_gui",
      "artifact://knowledge-pack/pyoptsparse",
      "artifact://recipe-object/pyoptsparse_optimization_uq_backbone",
      "artifact://verification-report/d27e1fdf-9e1d-540f-88fc-99829a79dfc0",
      "artifact://verification-report/ff85002e-061e-5d40-b2d8-6dfb3b48dbe3"
    ],
    "source_hashes": [
      {
        "artifact_ref": "artifact://environment-spec/eng_ipopt_onemkl_docker",
        "sha256": "8e4059fb97acb13655ec22ca77c1b70e665209fc96f582c1daacbe09f71d6dd8"
      },
      {
        "artifact_ref": "artifact://environment-spec/eng_ipopt_onemkl_gui",
        "sha256": "105a6bef5732828a98a07d870371a3a3f2ceaa6af1e428c628b4c7d2ef2e4640"
      },
      {
        "artifact_ref": "artifact://evidence-bundle/pyoptsparse_runtime",
        "sha256": "60e1f137eddbde6503f61e06bcd8b9f8432230f4d7cebf8e21b636eb2ca77b6d"
      },
      {
        "artifact_ref": "artifact://execution-adapter-spec/pyoptsparse_probe",
        "sha256": "f7861bdfd070f959145533e5b6873a929d951f2d2f70004eceef0e405a9dd7aa"
      },
      {
        "artifact_ref": "artifact://gui-session-spec/eng_ipopt_onemkl_gui",
        "sha256": "b46548aaa727087964636d21b2f6174f01453c2a8bef7cd0e84672ab6d273e13"
      },
      {
        "artifact_ref": "artifact://knowledge-pack/pyoptsparse",
        "sha256": "e885dc6ff9b41a5615cbcbddd282b1571e8272df0705ea9d3040d9275036c784"
      },
      {
        "artifact_ref": "artifact://recipe-object/pyoptsparse_optimization_uq_backbone",
        "sha256": "4cafd4096dba6aa6de6e13e1bc84d26291d6bc1a227903bffc3876063df6a6a6"
      },
      {
        "artifact_ref": "artifact://verification-report/d27e1fdf-9e1d-540f-88fc-99829a79dfc0",
        "sha256": "ed7d03663c6f5007d9de329d5da5c9b161d8cd8e67021e1fbf87cbcffd6eae25"
      },
      {
        "artifact_ref": "artifact://verification-report/ff85002e-061e-5d40-b2d8-6dfb3b48dbe3",
        "sha256": "b0155b1830c9b2d2c8c4bfc76c3f93454a4ec7c6129558371036bf0423da9bcd"
      }
    ],
    "task_class": "phase2_install_phase1_batch3b_nlp_wrapper"
  },
  "producer": {
    "component": "control_plane.knowledge_pool",
    "executor": "deterministic_compiler",
    "run_id": null,
    "task_packet_id": null
  },
  "schema_version": "1.0.0",
  "status": "ACTIVE",
  "supersedes": [],
  "updated_at": "2026-04-08T00:00:00Z",
  "validation_state": "VALID"
}
