{
  "artifact_id": "4ef1479c-a263-57a9-8505-eabb3442cdd4",
  "artifact_type": "ROLE_CONTEXT_BUNDLE",
  "created_at": "2026-04-08T00:00:00Z",
  "expires_at": null,
  "input_artifact_refs": [
    "artifact://environment-spec/eng_backbone_docker",
    "artifact://environment-spec/eng_calculix_docker",
    "artifact://environment-spec/eng_openfoam_docker",
    "artifact://evidence-bundle/precice_runtime",
    "artifact://execution-adapter-spec/precice_probe",
    "artifact://knowledge-pack/precice",
    "artifact://recipe-object/precice_workflow_coupling",
    "artifact://verification-report/5754f9b3-58dd-5326-9804-5382e5bf4fda"
  ],
  "invalid_reasons": [],
  "payload": {
    "compiled_summary": "preCICE: use precice, preCICE exchange contract, eng_backbone_docker. Adapter python scripts/verify_knowledge_runtime.py --environment-ref artifact://environment-spec/eng_backbone_docker takes working_dir, problem. Launcher knowledge/coding-tools/runtime/launchers/eng-backbone-container.sh. Recipe preCICE phase 2 runtime-linked recipe follows Resolve artifact://environment-spec/eng_backbone_docker as the canonical runtime surface, Run the linked health check for preCICE, Stop if the parent-runtime compatibility gate is still REWORK, Execute preCICE only inside its declared capability boundary and record the evidence refs. Runtime eng-backbone/docker_image at birtha/knowledge-eng-backbone:1.0.0; environment ref artifact://environment-spec/eng_backbone_docker; healthcheck commands python scripts/verify_knowledge_runtime.py --environment-ref artifact://environment-spec/eng_backbone_docker; verification refs artifact://verification-report/5754f9b3-58dd-5326-9804-5382e5bf4fda. Runtime gate: Smoke failed for precice: docker: Error response from daemon: failed to create task for container: failed to create shim task: OCI runtime create failed: runc create failed: unable to start container process: error during container init: exec: \"python\": executable file not found in $PATH.",
    "excluded_sections": [
      "capability boundaries",
      "tradeoffs",
      "fidelity and cost",
      "integration fit",
      "expected outputs",
      "invariants",
      "unit checks",
      "validation cases",
      "anti-patterns",
      "acceptance thresholds"
    ],
    "included_sections": [
      "apis and objects",
      "file contracts",
      "adapter usage",
      "minimal scaffolds",
      "implementation failure modes"
    ],
    "retrieval_keys": [
      "coder",
      "package",
      "phase3_package_precice",
      "precice",
      "true"
    ],
    "role": "coder",
    "role_context_bundle_id": "coder_d36d8c5371c97634",
    "schema_version": "1.0.0",
    "source_artifact_refs": [
      "artifact://environment-spec/eng_backbone_docker",
      "artifact://environment-spec/eng_calculix_docker",
      "artifact://environment-spec/eng_openfoam_docker",
      "artifact://evidence-bundle/precice_runtime",
      "artifact://execution-adapter-spec/precice_probe",
      "artifact://knowledge-pack/precice",
      "artifact://recipe-object/precice_workflow_coupling",
      "artifact://verification-report/5754f9b3-58dd-5326-9804-5382e5bf4fda"
    ],
    "source_hashes": [
      {
        "artifact_ref": "artifact://environment-spec/eng_backbone_docker",
        "sha256": "26ec4445daec3e64416dbe159c9320b17168fcffcbf7df3d0776ed705a9d2551"
      },
      {
        "artifact_ref": "artifact://environment-spec/eng_calculix_docker",
        "sha256": "c59c2cb55133e6e667aa04599e6d0ab22d7576bfd1a6eaba3da6304de05d32d1"
      },
      {
        "artifact_ref": "artifact://environment-spec/eng_openfoam_docker",
        "sha256": "b25885226e3cdb5eee72330d203a7a468721fdcb9a735eca74b92a64ed872df9"
      },
      {
        "artifact_ref": "artifact://evidence-bundle/precice_runtime",
        "sha256": "6e97d31d6a0e55a484efa519680363937a056a08dc9c014c5b2a7a46b02b77ca"
      },
      {
        "artifact_ref": "artifact://execution-adapter-spec/precice_probe",
        "sha256": "37d2d35f9877fcb56c759f0718bd19573b6ced0b2458be31d8dd90cbe8846a78"
      },
      {
        "artifact_ref": "artifact://knowledge-pack/precice",
        "sha256": "49d8481fd4cfb36b5221c5b265bc3d56f155dde068c40d8f8be52aaba199d858"
      },
      {
        "artifact_ref": "artifact://recipe-object/precice_workflow_coupling",
        "sha256": "150cf04d90cab9efb9b25b520873589c07f0523b8ca95d7c715e1603bda05cb8"
      },
      {
        "artifact_ref": "artifact://verification-report/5754f9b3-58dd-5326-9804-5382e5bf4fda",
        "sha256": "07a50421c2e1e461f2b9f31ce2057fd71709cf07b8164f5062c8007224382228"
      }
    ],
    "task_class": "phase3_package_precice"
  },
  "producer": {
    "component": "control_plane.knowledge_pool",
    "executor": "deterministic_compiler",
    "run_id": null,
    "task_packet_id": null
  },
  "schema_version": "1.0.0",
  "status": "ACTIVE",
  "supersedes": [],
  "updated_at": "2026-04-08T00:00:00Z",
  "validation_state": "VALID"
}
