{
  "artifact_id": "48c4da7a-dbc2-5405-9c80-b324ad38c8f8",
  "artifact_type": "ROLE_CONTEXT_BUNDLE",
  "created_at": "2026-04-08T00:00:00Z",
  "expires_at": null,
  "input_artifact_refs": [
    "artifact://environment-spec/eng_sparse_direct_family_docker",
    "artifact://evidence-bundle/superlu_runtime",
    "artifact://execution-adapter-spec/superlu_probe",
    "artifact://knowledge-pack/sparse_direct_family",
    "artifact://knowledge-pack/superlu",
    "artifact://recipe-object/superlu_solver_backends",
    "artifact://verification-report/8a2153ca-db40-56fc-89e3-86be7c1582b0"
  ],
  "invalid_reasons": [],
  "payload": {
    "compiled_summary": "SuperLU: solves SuperLU backend kernels reused by solver-backend workflows, SuperLU low-level numeric or geometric primitives inside a linked execution adapter. Best for SuperLU inside solver-backend workflows. Avoid Using SuperLU as a substitute for unrelated workflows outside solver-backend workflows, Treating SuperLU as implicitly verified without its linked runtime and evidence bundle. Runtime eng-sparse-direct-family/docker_image at birtha/knowledge-eng-sparse-direct-family:1.0.0; environment ref artifact://environment-spec/eng_sparse_direct_family_docker; healthcheck commands python scripts/verify_knowledge_runtime.py --environment-ref artifact://environment-spec/eng_sparse_direct_family_docker; verification refs artifact://verification-report/8a2153ca-db40-56fc-89e3-86be7c1582b0. Runtime gate: Bootstrap failed for artifact://environment-spec/eng_sparse_direct_family_docker: #0 building with \"desktop-linux\" instance using docker driver.",
    "excluded_sections": [
      "apis and objects",
      "file contracts",
      "adapter usage",
      "minimal scaffolds",
      "implementation failure modes",
      "invariants",
      "unit checks",
      "validation cases",
      "anti-patterns",
      "acceptance thresholds"
    ],
    "included_sections": [
      "capability boundaries",
      "tradeoffs",
      "fidelity and cost",
      "integration fit",
      "expected outputs"
    ],
    "retrieval_keys": [
      "general",
      "package",
      "phase3_package_superlu",
      "superlu",
      "true"
    ],
    "role": "general",
    "role_context_bundle_id": "general_0730025146e28b56",
    "schema_version": "1.0.0",
    "source_artifact_refs": [
      "artifact://environment-spec/eng_sparse_direct_family_docker",
      "artifact://evidence-bundle/superlu_runtime",
      "artifact://execution-adapter-spec/superlu_probe",
      "artifact://knowledge-pack/sparse_direct_family",
      "artifact://knowledge-pack/superlu",
      "artifact://recipe-object/superlu_solver_backends",
      "artifact://verification-report/8a2153ca-db40-56fc-89e3-86be7c1582b0"
    ],
    "source_hashes": [
      {
        "artifact_ref": "artifact://environment-spec/eng_sparse_direct_family_docker",
        "sha256": "5f0ddc6adc13ee5b9bb7ffacb1789afe029dbcff6a7ab8ef49d0fcef62888b90"
      },
      {
        "artifact_ref": "artifact://evidence-bundle/superlu_runtime",
        "sha256": "0aa210077e475a725a61c59d323b8e73b0bfa96e5f25133c39cb80aaa7c229db"
      },
      {
        "artifact_ref": "artifact://execution-adapter-spec/superlu_probe",
        "sha256": "0eb77f0303b774d6940673a31056cda38cf24cbb2456f0ece9ed4ff34bfd3b0f"
      },
      {
        "artifact_ref": "artifact://knowledge-pack/sparse_direct_family",
        "sha256": "fb791c05ea722b06df44569cdd722715ba6b8f6804097c4810fca3dea45cb812"
      },
      {
        "artifact_ref": "artifact://knowledge-pack/superlu",
        "sha256": "2597f152c6efa31338dec8936251f20d18d672e0498e1f0985004563ad93dee3"
      },
      {
        "artifact_ref": "artifact://recipe-object/superlu_solver_backends",
        "sha256": "fae0541de76388d256b082942e3ce48eb2b9019b00c1c02dfaff925af8a67fa4"
      },
      {
        "artifact_ref": "artifact://verification-report/8a2153ca-db40-56fc-89e3-86be7c1582b0",
        "sha256": "6a45c1a92e9e93af0cad0ce1e0106558ad16843cedf5cc18841d78c641f593d1"
      }
    ],
    "task_class": "phase3_package_superlu"
  },
  "producer": {
    "component": "control_plane.knowledge_pool",
    "executor": "deterministic_compiler",
    "run_id": null,
    "task_packet_id": null
  },
  "schema_version": "1.0.0",
  "status": "ACTIVE",
  "supersedes": [],
  "updated_at": "2026-04-08T00:00:00Z",
  "validation_state": "VALID"
}
