{
  "artifact_id": "5b322dda-a660-5e2a-a4d8-7866f4fdd47b",
  "artifact_type": "ROLE_CONTEXT_BUNDLE",
  "created_at": "2026-04-08T00:00:00Z",
  "expires_at": null,
  "input_artifact_refs": [
    "artifact://environment-spec/eng_trilinos_family_docker",
    "artifact://evidence-bundle/trilinos_muelu_runtime",
    "artifact://execution-adapter-spec/trilinos_muelu_probe",
    "artifact://knowledge-pack/trilinos_family",
    "artifact://knowledge-pack/trilinos_muelu",
    "artifact://recipe-object/trilinos_muelu_solver_backends",
    "artifact://verification-report/355071ee-e939-5741-a7ed-9ad38dd17563"
  ],
  "invalid_reasons": [],
  "payload": {
    "compiled_summary": "Trilinos MueLu: review Probe Trilinos MueLu through artifact://environment-spec/eng_trilinos_family_docker, Confirm the current Phase 2 gate state for Trilinos MueLu. Checklist Trilinos MueLu pack links to the intended environment spec(s), Trilinos MueLu adapter and evidence bundle reference the same runtime verification report, Trilinos MueLu anti-patterns and failure signatures match the module class and runtime path. Watch anti-patterns Using Trilinos MueLu for using trilinos muelu as a substitute for unrelated workflows outside solver-backend workflows., Skipping the linked health check and provenance capture for artifact://environment-spec/eng_trilinos_family_docker., Crossing the adapter boundary for Trilinos MueLu without a typed contract tied to trilinos muelu backend kernels reused by solver-backend workflows.. Healthcheck commands python scripts/verify_knowledge_runtime.py --environment-ref artifact://environment-spec/eng_trilinos_family_docker. Runtime eng-trilinos-family/docker_image at birtha/knowledge-eng-trilinos-family:1.0.0; environment ref artifact://environment-spec/eng_trilinos_family_docker; healthcheck commands python scripts/verify_knowledge_runtime.py --environment-ref artifact://environment-spec/eng_trilinos_family_docker; verification refs artifact://verification-report/355071ee-e939-5741-a7ed-9ad38dd17563. Runtime gate: Healthcheck failed for artifact://environment-spec/eng_trilinos_family_docker: docker: Error response from daemon: failed to create task for container: failed to create shim task: OCI runtime create failed: runc create failed: unable to start container process: error during container init: exec: \"python\": executable file not found in $PATH.",
    "excluded_sections": [
      "capability boundaries",
      "tradeoffs",
      "fidelity and cost",
      "integration fit",
      "expected outputs",
      "apis and objects",
      "file contracts",
      "adapter usage",
      "minimal scaffolds",
      "implementation failure modes"
    ],
    "included_sections": [
      "invariants",
      "unit checks",
      "validation cases",
      "anti-patterns",
      "acceptance thresholds"
    ],
    "retrieval_keys": [
      "package",
      "phase3_package_trilinos_muelu",
      "reviewer",
      "trilinos_muelu",
      "true"
    ],
    "role": "reviewer",
    "role_context_bundle_id": "reviewer_979cc0d5a6719523",
    "schema_version": "1.0.0",
    "source_artifact_refs": [
      "artifact://environment-spec/eng_trilinos_family_docker",
      "artifact://evidence-bundle/trilinos_muelu_runtime",
      "artifact://execution-adapter-spec/trilinos_muelu_probe",
      "artifact://knowledge-pack/trilinos_family",
      "artifact://knowledge-pack/trilinos_muelu",
      "artifact://recipe-object/trilinos_muelu_solver_backends",
      "artifact://verification-report/355071ee-e939-5741-a7ed-9ad38dd17563"
    ],
    "source_hashes": [
      {
        "artifact_ref": "artifact://environment-spec/eng_trilinos_family_docker",
        "sha256": "698e541222f13d8054998a70ca2e31e99fcbd1da3404a1d0c15ab4f8f46c907f"
      },
      {
        "artifact_ref": "artifact://evidence-bundle/trilinos_muelu_runtime",
        "sha256": "6da72888425d24f09bdde561c4e5d330618181b6f44d608a8288b4b1f1affc31"
      },
      {
        "artifact_ref": "artifact://execution-adapter-spec/trilinos_muelu_probe",
        "sha256": "eaef85d0fb6c0ba6b1582c0aa3869d79823fd3af87fbe23914160dc8be80ecd7"
      },
      {
        "artifact_ref": "artifact://knowledge-pack/trilinos_family",
        "sha256": "a0e8bccdaa5171332af458bf810f765200943e493fdf84c0cd5efd22100b1349"
      },
      {
        "artifact_ref": "artifact://knowledge-pack/trilinos_muelu",
        "sha256": "82ec87e738bcba0a4a923bb016bc7d82bb552d2de957e585345f513c6e5dd656"
      },
      {
        "artifact_ref": "artifact://recipe-object/trilinos_muelu_solver_backends",
        "sha256": "cfce5f1fbce7b9b2556c4df9093d48409e0bef45d767af0622898d9e915cf82a"
      },
      {
        "artifact_ref": "artifact://verification-report/355071ee-e939-5741-a7ed-9ad38dd17563",
        "sha256": "29ff1d1b30d1df8dfd28f0bca4c043b993ecd6f7b2f5186906823dfde9ee1fd5"
      }
    ],
    "task_class": "phase3_package_trilinos_muelu"
  },
  "producer": {
    "component": "control_plane.knowledge_pool",
    "executor": "deterministic_compiler",
    "run_id": null,
    "task_packet_id": null
  },
  "schema_version": "1.0.0",
  "status": "ACTIVE",
  "supersedes": [],
  "updated_at": "2026-04-08T00:00:00Z",
  "validation_state": "VALID"
}
