{
  "artifact_id": "54c0b4e6-9a1b-5746-98fc-17b6ff1a45a9",
  "artifact_type": "ROLE_CONTEXT_BUNDLE",
  "created_at": "2026-04-08T00:00:00Z",
  "expires_at": null,
  "input_artifact_refs": [
    "artifact://environment-spec/eng_trilinos_family_docker",
    "artifact://evidence-bundle/trilinos_ifpack2_runtime",
    "artifact://execution-adapter-spec/trilinos_ifpack2_probe",
    "artifact://knowledge-pack/trilinos_family",
    "artifact://knowledge-pack/trilinos_ifpack2",
    "artifact://recipe-object/trilinos_ifpack2_solver_backends",
    "artifact://verification-report/bd12c942-b6e5-51da-9379-9aecbd8429ba"
  ],
  "invalid_reasons": [],
  "payload": {
    "compiled_summary": "Trilinos Ifpack2: review Probe Trilinos Ifpack2 through artifact://environment-spec/eng_trilinos_family_docker, Confirm the current Phase 2 gate state for Trilinos Ifpack2. Checklist Trilinos Ifpack2 pack links to the intended environment spec(s), Trilinos Ifpack2 adapter and evidence bundle reference the same runtime verification report, Trilinos Ifpack2 anti-patterns and failure signatures match the module class and runtime path. Watch anti-patterns Using Trilinos Ifpack2 for using trilinos ifpack2 as a substitute for unrelated workflows outside solver-backend workflows., Skipping the linked health check and provenance capture for artifact://environment-spec/eng_trilinos_family_docker., Crossing the adapter boundary for Trilinos Ifpack2 without a typed contract tied to trilinos ifpack2 backend kernels reused by solver-backend workflows.. Healthcheck commands python scripts/verify_knowledge_runtime.py --environment-ref artifact://environment-spec/eng_trilinos_family_docker. Runtime eng-trilinos-family/docker_image at birtha/knowledge-eng-trilinos-family:1.0.0; environment ref artifact://environment-spec/eng_trilinos_family_docker; healthcheck commands python scripts/verify_knowledge_runtime.py --environment-ref artifact://environment-spec/eng_trilinos_family_docker; verification refs artifact://verification-report/bd12c942-b6e5-51da-9379-9aecbd8429ba. Runtime gate: Healthcheck failed for artifact://environment-spec/eng_trilinos_family_docker: docker: Error response from daemon: failed to create task for container: failed to create shim task: OCI runtime create failed: runc create failed: unable to start container process: error during container init: exec: \"python\": executable file not found in $PATH.",
    "excluded_sections": [
      "capability boundaries",
      "tradeoffs",
      "fidelity and cost",
      "integration fit",
      "expected outputs",
      "apis and objects",
      "file contracts",
      "adapter usage",
      "minimal scaffolds",
      "implementation failure modes"
    ],
    "included_sections": [
      "invariants",
      "unit checks",
      "validation cases",
      "anti-patterns",
      "acceptance thresholds"
    ],
    "retrieval_keys": [
      "package",
      "phase3_package_trilinos_ifpack2",
      "reviewer",
      "trilinos_ifpack2",
      "true"
    ],
    "role": "reviewer",
    "role_context_bundle_id": "reviewer_832e393d7ae8b76b",
    "schema_version": "1.0.0",
    "source_artifact_refs": [
      "artifact://environment-spec/eng_trilinos_family_docker",
      "artifact://evidence-bundle/trilinos_ifpack2_runtime",
      "artifact://execution-adapter-spec/trilinos_ifpack2_probe",
      "artifact://knowledge-pack/trilinos_family",
      "artifact://knowledge-pack/trilinos_ifpack2",
      "artifact://recipe-object/trilinos_ifpack2_solver_backends",
      "artifact://verification-report/bd12c942-b6e5-51da-9379-9aecbd8429ba"
    ],
    "source_hashes": [
      {
        "artifact_ref": "artifact://environment-spec/eng_trilinos_family_docker",
        "sha256": "698e541222f13d8054998a70ca2e31e99fcbd1da3404a1d0c15ab4f8f46c907f"
      },
      {
        "artifact_ref": "artifact://evidence-bundle/trilinos_ifpack2_runtime",
        "sha256": "254f587efd438da774db4ebd4e0ced52ac6dbd0e67e1e5955060987aafdaa825"
      },
      {
        "artifact_ref": "artifact://execution-adapter-spec/trilinos_ifpack2_probe",
        "sha256": "dd538bfe93641989e1ac9f003827d71f45461a3b005087eb60448eae5ae4fde4"
      },
      {
        "artifact_ref": "artifact://knowledge-pack/trilinos_family",
        "sha256": "a0e8bccdaa5171332af458bf810f765200943e493fdf84c0cd5efd22100b1349"
      },
      {
        "artifact_ref": "artifact://knowledge-pack/trilinos_ifpack2",
        "sha256": "750d859b144b480e7ca5684a797e4c11c17e5c03b75b0b34b5bda21ee560f8af"
      },
      {
        "artifact_ref": "artifact://recipe-object/trilinos_ifpack2_solver_backends",
        "sha256": "13469e3ca6b13b583a9a062158aa40a82d8908a7af5cf0ec329be447f920e3ba"
      },
      {
        "artifact_ref": "artifact://verification-report/bd12c942-b6e5-51da-9379-9aecbd8429ba",
        "sha256": "8aebea90404ae72c2292886583bf85d82dae34f83c2ee607754e794533cfe40e"
      }
    ],
    "task_class": "phase3_package_trilinos_ifpack2"
  },
  "producer": {
    "component": "control_plane.knowledge_pool",
    "executor": "deterministic_compiler",
    "run_id": null,
    "task_packet_id": null
  },
  "schema_version": "1.0.0",
  "status": "ACTIVE",
  "supersedes": [],
  "updated_at": "2026-04-08T00:00:00Z",
  "validation_state": "VALID"
}
